{
  "tenant_id": "tenant-acme",
  "correlation_id": "corr-approval-0001",
  "idempotency_key": "approval-req-00000001",
  "actor": {
    "type": "user",
    "id": "user-owner-01"
  },
  "target": {
    "server_id": "server-acme-01"
  },
  "decision_ref": {
    "policy_version": "v1",
    "classification": "CONFIDENTIAL",
    "destination": "private_endpoint",
    "reason_code": "AI_EGRESS_APPROVAL_REQUIRED_CONFIDENTIAL_PRIVATE_ENDPOINT"
  },
  "approve": true,
  "justification": "Approved for the Q3 vendor-review private endpoint pilot."
}
