{
  "tenant_id": "tenant-acme",
  "correlation_id": "corr-approval-0002",
  "idempotency_key": "approval-req-00000002",
  "actor": {
    "type": "user",
    "id": "user-owner-02"
  },
  "target": {
    "server_id": "server-acme-02",
    "deployment_id": "deployment-acme-hermes-02"
  },
  "decision_ref": {
    "policy_version": "v1",
    "classification": "RESTRICTED",
    "destination": "private_endpoint",
    "reason_code": "AI_EGRESS_APPROVAL_REQUIRED_RESTRICTED_PRIVATE_ENDPOINT"
  },
  "approve": false
}
